"VanEck to Close Ethereum Strategy ETF, Reassessing Crypto Investment Approach","Score: 0.0, 1, 0.19032500000000002, 4"
Ethereum’s Pivotal September – Surging Adoption and Key Price Catalysts,"Score: 0.0, 1, 0.22469999999999998, 7"
"Ethereum Hits 4-Month High in Network Growth with 126,210 New Wallets Created on Typically Quiet Sunday","Score: 0.5574, 2, 0.48105000000000003, 6"
"Ethereum Slips 6% As Gas Fee Crashes: Will ETH Bears Break $2,000?","Score: -0.4019, 2, 0.47468571428571427, 7"
US Crypto Legislation Missing from Harris' Policy as Trump Takes Crypto Lead,"Score: -0.296, 2, 0.33282727272727275, 11"
Maybe it will be useful for someone? TradingView FREE [Premium pack],"Score: 0.7351, 6, 0.4867571428571429, 7"
Early Ethereum adviser sues law firm for $100M over crypto extortion case defense,"Score: 0.128, 3, 0.11101904761904764, 21"
Swiss branch of BBVA bank brings USDC for institutional clients,"Score: 0.0, 4, 0.32346842105263157, 19"
Ethereum News: On-Chain Data Suggests More Pain Ahead for ETH Price,"Score: -0.5563, 5, 0.1752578947368421, 19"
"Ethereum Foundation, Vitalik Buterin-Linked Wallets On Selling Spree, ETH Price Drop","Score: -0.2732, 4, 0.23877, 20"
Anonymous Whale Makes Significant Move in Ethereum Market,"Score: 0.2023, 8, 0.2495181818181818, 22"
Asset Tokenization Could Awaken A Coming-Of-Age For Investors,"Score: 0.3612, 3, 0.3465666666666667, 6"
"‘Big sybil hunt’ and durable users helped LayerZero airdrop succeed, says CEO","Score: 0.4939, 7, 0.1928294117647059, 34"
"With the rise of unregistered users, here are a few messages that you can easily COPY and PASTE to encourage newbies to register their wallets!","Score: 0.6908, 7, 0.2643716417910448, 67"
Ethereum Metrics Mirror 2016: Will ETH's Price Follow a Similar Path,"Score: 0.0, 6, 0.2526625, 48"
I’m an investor 😎,"Score: 0.0, 30, 0.2680717948717949, 39"
"Ethereum Faces Challenges: Price Concerns, Network Activity, and Interoperability Issues","Score: 0.0772, 5, 0.29487619047619046, 21"
Crypto firm’s CEO resigns after being robbed of company funds at gunpoint,"Score: -0.3182, 15, 0.1235026119402985, 268"
OP Crypto Set To Rise Gains As Key Indicators Point To an Uptrend,"Score: 0.5267, 13, 0.18451732283464567, 127"
3 Things That Could Influence Crypto Markets This Week,"Score: 0.0, 8, 0.18299203539823009, 113"
"Vitalik Buterin Responds to Rumored Sales, Reaffirms Commitment to Ethereum and Charitable Causes","Score: 0.6486, 10, 0.24882692307692308, 78"
Friend.tech token drops 26% after team shirks control of smart contracts,"Score: 0.1531, 7, 0.13254069767441862, 86"
What Are dApps? How They Differ From Traditional Apps,"Score: 0.0, 9, 0.24001846153846154, 65"
"Crypto ownership isn’t rising with recent market growth, Fed survey claims","Score: 0.3818, 12, 0.1540728682170543, 129"
Ethereum Price Recovery May Stall Near 100-SMA: Is a Drop Coming?,"Score: -0.4404, 8, 0.1696416666666667, 36"
Early Ethereum adviser sues law firm for $100M over crypto extortion case defense,"Score: 0.128, 8, 0.23464444444444446, 45"
Asset Tokenization Could Awaken A Coming-Of-Age For Investors,"Score: 0.3612, 17, 0.258383950617284, 81"
Ethereum 50% below its all-time high partially due to interoperability issues,"Score: 0.0, 8, 0.2514529411764706, 34"
"Daily General Discussion - September 09, 2024 (UTC+0)","Score: 0.0, 12, 0.21239973045822105, 371"
"Crypto Strategist Issues Ethereum Warning, Says Nearly 70% Collapse Is His Base-Case Outlook for ETH","Score: -0.6808, 5, 0.14829285714285717, 28"
Tether invests $100M in agriculture firm (550k liters/day milk producer) as stablecoin competition grows,"Score: 0.0, 2, 0.28683333333333333, 6"
MATIC to POL Migration Is Now Live,"Score: 0.0, 11, 0.18604754098360657, 61"
Friend.Tech team renounces control of smart contracts following stagnant growth,"Score: 0.6486, 8, 0.13604482758620692, 29"
Ethereum’s crisis: How leadership’s mixed messages affect ETH,"Score: -0.6249, 13, 0.15270175438596492, 57"
"SEC to enforce strict regulations in capital market, crypto space - The Nation Newspaper","Score: 0.0, 12, 0.12469000000000001, 50"
Coinbase Lobbying Efforts In the US Hits Historic Level,"Score: -0.0772, 13, 0.199435, 40"
BlackRock Remains Only Ethereum Buyer Among ETFs,"Score: 0.0, 43, 0.3235452830188679, 53"
"Crypto Markets Forming Huge Bear Trap Before Ascent Into Euphoria, According to Crypto Analyst","Score: 0.6486, 11, 0.23460958904109588, 73"
OKX Supports Three New Memecoins,"Score: 0.4019, 11, 0.1996021276595745, 47"
Why it may not be fair to say Fed made inflation 'mistake',"Score: -0.2411, 4, -0.026164999999999994, 20"
Ethereum DEX networks are enjoying major increase in volume,"Score: 0.6908, 12, 0.32629615384615385, 26"
Bybit and Binance Secure Full Authorization in Kazakhstan’s Crypto Boom,"Score: 0.34, 16, 0.22513555555555556, 90"
1.9 Billion Shiba Inu in 24 Hours: SHIB Whales Making Comeback,"Score: 0.0, 15, 0.20532058823529412, 68"
"""SPECTRE AI"" from $0.03216 n 1/1/2024 to $1.14 n 8/9/2024 a x35 surge, f $7k invested n 1/1/2024 today it's worth quarter a million !","Score: 0.2263, 4, 0.22919, 30"
September’s Key Events Which Will Review Struggling Crypto Market,"Score: -0.4215, 11, 0.22913125, 48"
"RWA Sector Continues Expansion, Led by Usual Money, Hashnote & Ondo","Score: 0.0, 13, 0.27463424657534247, 73"
Coinbase scores partial victory in legal battle against the SEC,"Score: -0.2732, 5, 0.29725454545454544, 11"
Chainlink’s $22 potential: Why this analyst sees big gains for LINK,"Score: 0.5267, 15, 0.3220734693877551, 49"
Will Polymarket Launch a Token? Why Some Traders Are Betting on an Airdrop - Decrypt,"Score: 0.0, 14, 0.24261756756756758, 74"
"$2K or Below, which do you think is the bottom this month and why, share your TA wisdom!","Score: 0.6808, 25, 0.09885033557046981, 149"
Political Meme Coin Economy Shrinks by $420M as US Election Nears,"Score: 0.0, 15, 0.0871688888888889, 45"
Sonic blockchain reaches record 720ms finality in testnet phase,"Score: 0.0258, 18, 0.262453125, 32"
Trump turns to outlandish promises to offset $7 trillion in tax cuts,"Score: 0.0516, 13, 0.36928387096774196, 31"
"Ethereum Faces Resistance at $2,300 as Market Challenges Persist","Score: 0.0772, 13, 0.16837368421052631, 57"
Crypto market rebounds on Yellen’s positive macro outlook – Gains ahead?,"Score: 0.7906, 7, 0.28381500000000004, 40"
Mastercard's Spend Card: Effortlessly Use Ethereum and Other Cryptos Directly from Your Wallet,"Score: 0.0, 10, 0.26827142857142855, 63"
Ethereum's Buterin Entertains Community With Hilarious Horse Meme,"Score: 0.7269, 4, 0.27964, 30"
Analyst Crashes Shiba Inu Investors’ Hope For Massive Rally With ‘Realistic’ Prediction,"Score: 0.0516, 9, 0.28279600000000005, 25"
Can Ethereum provide a settlement layer for financial markets?,"Score: 0.0, 15, 0.30207241379310346, 58"
Ethereum Bearish Phase: Analyst Predicts a Major Comeback Soon,"Score: 0.0, 4, 0.28164137931034483, 29"
Ethereum (ETH) Metric Makes Crucial Comeback: Details,"Score: 0.0, 13, 0.22294871794871796, 78"
Tornado Cash Sees Resurgence With $50 Million Laundered This September,"Score: 0.0, 14, 0.18544395604395608, 91"
Understanding MEV And Its Impact On Ethereum Decentralization,"Score: 0.0, 8, 0.275255, 20"
"Ethereum Price Rises Nearly 3% to $2,300 as ETF Developments Impact Market Sentiment","Score: 0.0, 6, 0.3201272727272727, 11"
Hackers Target Ethereum in Major Crypto Heists,"Score: 0.0, 20, 0.19923620689655175, 58"
ONDO Price Sliding To Lower Levels: What Levels To Watch?,"Score: -0.296, 13, 0.18513333333333334, 105"
Tadle Joins Chainlink Build To Unlock Liquidity In Crypto Pre-Markets,"Score: 0.296, 10, 0.3131851851851852, 27"
"‘We’ve Barely Started’ – Analyst Predicts Craziest Bull Market Yet, Unveils Timeline for Massive Crypto Surges","Score: -0.0516, 33, 0.23541346153846154, 104"
Fed Report Analyzes How Crypto Price Shifts Influence Ownership,"Score: 0.0, 12, 0.27697045454545455, 44"
Why Arbitrum could be poised for a 25% surge in September,"Score: 0.25, 15, 0.2300808, 125"
Ethereum L1 Revenue Dips to Almost Zero After Dencun Upgrade,"Score: 0.0, 5, 0.1874818181818182, 22"
Uniswap Breaks Out of Bearish Trend: What’s Next for the Altcoin,"Score: 0.0, 9, 0.3188, 35"
What Are Stablecoins?,"Score: 0.0, 14, 0.2454372093023256, 43"
Prominent Economic Analyst Predicts a ‘Bloodbath’ in the Spot Crypto Market,"Score: 0.3182, 15, 0.12256629213483146, 89"
Why Ethereum may hit +$4k in a few months,"Score: 0.0, 28, 0.178376, 50"
"US National Debt Explodes by $684,322,497,000 in Three Months As Fitch Warns America Has Failed To Fix Growing Debt Burden","Score: -0.8176, 20, 0.05274505494505496, 91"
Is Crypto Doomed or Ready For a Comeback? Legendary Crypto Analyst Weighs In,"Score: -0.4019, 13, 0.21151183431952664, 169"
"Polygon Price Prediction 2024, 2025-2030","Score: 0.0, 15, 0.17559837398373984, 123"
Why Is Ethereum (ETH) Losing Ground? Key Report Explains ETH Struggles,"Score: -0.5994, 13, 0.025984027777777793, 144"
What do you think about LDO DAO token and how much MC do you think it is capable of getting in this bull market? What price do you see for it when you look at the chart?,"Score: 0.3818, 1, 0.263, 8"
"Here’s the Only Reason Shiba Inu Cannot Surge to $1, $0.01, or $0.001","Score: 0.0, 14, 0.18143550295857988, 169"
Penpie Crypto DeFi Protocol Exploiter Successfully Laundered All $27M ETH,"Score: 0.4939, 11, 0.23748055555555558, 36"
Best DEX Aggregators for Crypto Trading,"Score: 0.6369, 9, 0.33117241379310347, 58"
Regulatory Clarity in Crypto: What Ethereum ETF Approval Means for Future Regulations,"Score: 0.7003, 13, 0.26390357142857146, 28"
Demand for Yen stablecoins is ‘only a matter of time’  — Brad Garlinghouse,"Score: -0.1027, 18, 0.11175500000000001, 40"
Kamala Harris proposes 25% tax on unrealized gains for high-net-worth individuals,"Score: 0.5267, 2437, 0.31593982808022925, 2792"
