Bitcoin network activity hitting three year lows,"Score: -0.2732, 3, 0.872, 3"
BitPay Questions (Refunds_,"Score: 0.0, 1, 0, 0"
Upgrade that modem!,"Score: 0.0, 9, 0.14703333333333332, 6"
"NanoGPT updates: Increased BCH limits, Reflection 70B, Gemini Pro Exp, decreased pricing, permanent referral links","Score: 0.2732, 4, 0, 0"
Ex-FTX Executive Accused in Chinese Bribery Scandal,"Score: -0.6249, 2, 0, 0"
UTXO Set Optimization (GP Shorts),"Score: 0.3818, 9, 0.2394, 7"
What to Expect if BTC Falls Below $56K,"Score: 0.0, 2, 0, 0"
Something Isn't Right About Roger Ver's Indictment... thoughts?,"Score: 0.0, 31, 0.15949156626506025, 83"
Looking for defamation lawyer in Arizona,"Score: 0.0, 1, 0.11896666666666667, 12"
California DOJ and Robinhood Reach $3.9M Settlement,"Score: 0.0258, 5, 0.49062, 10"
Is This The Perfect Time To Buy More Bitcoin?,"Score: 0.5719, 3, 0.18283333333333332, 9"
"The Future of Bitcoin: Will it have more utility? Can it go beyond ""store of value""?","Score: 0.34, 15, 0.09814210526315792, 133"
"Former Mt. Gox CEO to Launch European Exchange, EllipX, Promising to ""Right the Wrongs""","Score: -0.1027, 7, 0.18415526315789474, 38"
Paying With Crypto at a Non-Crypto Store: Bitcoin Cash Surprise,"Score: 0.2732, 13, 0.7184, 1"
r/Political_Revolution Isn't really all that keen on an actual Political Revolution...,"Score: 0.4144, 18, 0.10691449275362319, 69"
hacked?,"Score: -0.4019, 3, 0.42953030303030304, 33"
"If you want op_cat, you want Bitcoin Cash!","Score: 0.1531, 21, 0.09027272727272727, 11"
How to withdraw Btc (Lightning Network) help,"Score: 0.4019, 3, -0.09791875, 16"
Bitcoin Set to Rally as Fed's Rate Cut Fuels Market Optimism for BINANCE:BTCUSD by DEXWireNews,"Score: 0.34, 0, 0, 0"
KYC Prompt in bitcoin.com wallet,"Score: 0.0, 21, -0.08771343283582089, 67"
Casascius token for sale below spot,"Score: 0.0, 2, 0.14750000000000002, 4"
Wallet that let's you generate fresh addresses before the previous was used,"Score: 0.3182, 3, 0, 0"
Updates to CHIP-2024-07-BigInt: High-Precision Arithmetic for Bitcoin Cash,"Score: 0.0, 25, 0.72601875, 48"
Video of Imprisoned Binance Exec Sparks Demand for Release,"Score: -0.3818, 6, 0.13967894736842107, 19"
How Will Fed’s Decision Affect Bitcoin Price?,"Score: 0.0, 1, 0, 0"
How people cash out crypto actually in Europe ?,"Score: 0.0, 7, 0.27476, 20"
Bullish flag?,"Score: 0.0, 3, -0.25007999999999997, 5"
"🐋🚨 Whale Accumulates 2,000 Bitcoin in Just 4 Days, Now Holds $490 Million in BTC","Score: 0.0, 2, 0.296, 3"
Bitcoin Funds Sees Outflows as Investors Bet on Price Decline for BINANCE:BTCUSDT by DEXWireNews,"Score: 0.0, 0, 0, 0"
$54K vs $64K - What will Bitcoin hit first??,"Score: 0.0, 5, 0.5608, 5"
I created a standarized design that could fix scams that probably decimate P2P Cash-to-Crypto markets (RFC Draft),"Score: -0.4019, 18, 0.26085625, 32"
How to buy onlh $10 of btc that can be sent to someone else's wallet address,"Score: 0.0, 6, 0.45170000000000005, 7"
Key Q&As by alienc0der about BTC Merge-Mining on Zenon Network,"Score: 0.0, 5, 0, 0"
The Premise of Functional Money (GP Shorts),"Score: 0.0, 10, 0, 0"
"Richest Bitcoin Holder Now Behind The Bars, Why?","Score: 0.5267, 3, -0.34, 3"
Vitalik Buterin Denies Rumors of Profiting from ETH Sales,"Score: -0.0516, 2, 0.13685000000000003, 2"
Crypto Hack Alert,"Score: 0.296, 0, 0, 0"
Weekly roundup from the crypto world,"Score: 0.0, 1, 0, 0"
Every Satoshi Matters,"Score: 0.0258, 4, 0, 0"
Crypto Exchange Protects Elderly from Scams by Monitoring Withdrawals 🚨,"Score: -0.3182, 4, 0.31912500000000005, 8"
GP Spaces 33 Recap: What's Up,"Score: 0.0, 8, 0, 0"
"17 hours remain until my campaign expires, and I hope it will be funded. If it ends without success, this will be my last Flipstarter campaign.","Score: -0.0253, 18, -0.11505238095238096, 21"
What are some good resources/tutorials you can suggest for BCH implementation to a video game?,"Score: 0.4404, 19, 0.13192857142857142, 14"
No Alt season. The return of the King,"Score: -0.296, 5, 0.7506, 2"
US Elections Trump VS Kamala and Bitcoin,"Score: 0.0, 3, -0.16073333333333334, 3"
🧑‍💻 MicroStrategy presented an open source Bitcoin24 macromodel on GitHub that predicts the level of bitcoin adoption as well as the asset's price growth for the next 21 years,"Score: 0.7351, 3, 0, 0"
"How is Bitcoin Cash? By being very fast, secure, and cheap and easy to use","Score: 0.6786, 45, 0.39581999999999995, 5"
"Whatever happened to ""Satoshi's Angels""","Score: 0.0, 18, 0.6162095238095238, 21"
Getting a lot of ads for XApp Bank on Reddit,"Score: 0.0, 0, 0, 0"
Is Bitcoin Bull Run Over?,"Score: 0.0, 2, 0.0043, 6"
"I just started a flipstarter campaign for my project: ""Ink Support"". A ko-fi alternative for the Lebanese people","Score: 0.4019, 12, 0.35532307692307696, 13"
Putin’s Crypto Scheme to Beat Sanctions,"Score: 0.0, 3, 0.1531, 3"
Bitcoin ATM scams are soaring — and older adults are increasingly the victims,"Score: -0.7003, 6, 0, 0"
Kallisti on the Outlaw Crypto Podcast,"Score: 0.0, 15, 0.0, 3"
The Bitcoin Cash Podcast #125: Journal of Global Surgery feat. Saqib Noor,"Score: 0.0, 19, 0.8807, 2"
Bitcoin ATM installations surge in Australia,"Score: 0.0, 7, 0.3818, 1"
These 2 coins can breakout any day now...,"Score: 0.0, 0, 0, 0"
This one little trick that will scare your bank and politicans shitless,"Score: -0.4779, 15, 0, 0"
How Laszlo Hanyecz’s Pizza Purchase Became Historic?,"Score: 0.0, 7, 0.34, 1"
"El Salvador's Bitcoin Adoption Falls Short, Bukele Admits","Score: 0.296, 2, 0.0, 3"
The origin of the BCH Bull,"Score: 0.0, 14, 0.59354, 5"
Do we have true merged chart for Bitcoin somewhere?,"Score: 0.4215, 3, 0.10436060606060607, 33"
Bitcoin Casher has a change of heart and becomes a Bitcoiner,"Score: 0.34, 8, 0.009272222222222244, 36"
El Salvador’s Bukele says ‘Bitcoin hasn't had the widespread adoption we hoped for',"Score: 0.6124, 21, 0.27258333333333334, 66"
"Is it just this guy, or do other people here regret trading their Bitcoin for BCH after the fork?","Score: -0.4215, 22, -0.03807021276595745, 141"
"Does the correlation between total BTC mined (linear), and the market price (log scale) imply there is an asymptote to the market price?","Score: 0.0, 5, 0.35657500000000003, 4"
"No worries BTC-ers, Blockstream has got your back!","Score: -0.4019, 53, -0.10961373626373626, 182"
Will Buffet's last sell off affect the crypto markets?,"Score: 0.0, 2, 0.09705, 2"
"🫡 Bitcoin Archive pays tribute to Hal Finney by supplementing his post each year about ""bitcoin is up and running"" with posts about bitcoin still working.","Score: -0.1027, 13, 0.21075, 4"
"NanoGPT updates: free model, unfiltered model, earn page, pricing page, UX improvements","Score: 0.743, 10, 0.9765, 7"
Is the Crypto Market Heading for another Crash?,"Score: -0.4019, 5, 0.04525, 4"
Onboarding E-wallet Users (GP Shorts),"Score: 0.0, 9, 0, 0"
Bitcoin Long-Term Holders Reach $10 Billion Milestone,"Score: 0.0258, 1, 0.20095, 2"
Could you suggest?,"Score: 0.0, 3, 0.11744, 15"
Bitcoin @54k,"Score: 0.0, 5, 0.02121333333333333, 15"
Is Bitcoin due for another correction??,"Score: 0.0, 3, 0, 0"
"10 Years Ago Today, a Bitcoin Legend Passed Away!","Score: 0.0, 19, -0.011840000000000007, 5"
Why Is Bitcoin Dropping Today?,"Score: 0.0, 6, -0.17351666666666665, 18"
"When you buy BTC with your money from your bank, what does it say on the statement description?","Score: 0.0, 5, -0.026406666666666672, 15"
Is it possible to buy bitcoins by paying through Amazon Pay?,"Score: 0.0772, 5, 0.445, 3"
"With just 5 days left before our Flipstarter campaign expires, we need your support! We've raised 1.41 BCH so far from 7 contributors toward our target.","Score: 0.4019, 5, 0, 0"
"Can BTC break above $63,000 barrier?","Score: -0.128, 3, 0.4176, 5"
"I'm kinda new to crypto , what are some ways to buy giftcards online using bitcoin? Other than coinsbee","Score: 0.0, 6, 0.3312272727272727, 11"
🚨 Thai Authorities Raid Illegal Bitcoin Mining Operation in Ratchaburi,"Score: -0.5106, 0, 0, 0"
"FundMe.Cash Campaign for BCH Podcast Episodes 126 - 135. If you're enjoying the show, consider donating!","Score: 0.5267, 9, 0.6314666666666667, 3"
Marc De Mesel confirmed as speaker at the international BCH conference in Argentina,"Score: 0.0, 33, 0.0, 5"
I use Signal messaging app - their donations page accepts Crypto (including BitcoinCash). If you use Signal consider supporting them.,"Score: 0.6369, 20, 0.11297692307692306, 39"
BTC and BCH transfers: a case study,"Score: 0.0, 22, 0.15060084033613444, 119"
I made a video showcasing how much your BTC would be worth if you bought 100usd worth of BTC every month (DCA) since 2010,"Score: 0.4215, 3, 0.19506363636363638, 11"
Mainnet JS and Mainnet.Cash (GP Shorts),"Score: 0.0, 10, 0, 0"
Can someone explain this please?,"Score: 0.3869, 23, -0.2535015151515152, 66"
How Durov’s Arrest Could Affect Bitcoin?,"Score: -0.34, 6, 0.18212857142857145, 7"
GP Spaces 32 Recap: Building Confidence Recap,"Score: 0.5106, 10, -0.9517, 5"
Could you help me with cryptocurrency purchases with a debit card?,"Score: 0.4019, 7, 0.008275000000000001, 20"
BitcoinVN exchange - Adjustments in displayed data (induced by r/btc thread),"Score: 0.0, 13, 0.270190625, 32"
🚀 Bitcoin ETFs Break Records as Institutional Adoption Surges,"Score: 0.0, 1, 0.34, 1"
Could someone explain it to me?,"Score: 0.0, 20, 0.14008425925925924, 108"
The Bitcoin Cash Podcast #124: Properties of Bitcoin & BTC in El Salvador feat. NoPara,"Score: 0.0, 17, 0, 0"
Bitcoin cares,"Score: 0.4939, 34, 0.12448333333333333, 12"
Bitcoin is high but the mining is so low ?,"Score: -0.5591, 1, 0.2826, 8"
Will Bitcoiners Ever Consider a Bitcoin exchange?,"Score: 0.0, 2, -0.009038461538461533, 13"
"Get to know ""Haveno"" the long awaited decentralized exchange and full LocalMonero replacement that enables direct Fiat-to-Crypto trades.","Score: -0.0258, 23, 0.163825, 16"
Bitcoin Price Hits $64k! New All-Time High Soon?,"Score: 0.0, 2, 0.286675, 4"
To the Moon 🌚🌚,"Score: 0.0, 5, 0, 0"
El Salvador Expands Bitcoin Holdings with Daily Purchases: Adds 162 BTC to National Reserve 🚀,"Score: 0.1027, 8, -0.25684, 10"
Fed Chair Jerome Powell: Time Has Come for Policy to Adjust. Will we see BCH go back to $700 like the last time the market anticipated rate cuts?,"Score: 0.4215, 14, 0.07702499999999998, 16"
Editing the ABLA CHIP (GP Shorts),"Score: 0.0, 17, 0.8443999999999999, 3"
"The word capital is an integral part of the word capitalism. When we have a form of capital that redistributes value from society at large towards the super rich and the state, we don't have capitalism — we have socialism for the super rich","Score: 0.9545, 11, 0.4774227272727272, 22"
Will Powell’s Speech Send Bitcoin Higher?,"Score: 0.0, 0, 0, 0"
Ex-FTX Exec's Partner Accused of Illegal Campaign Funding,"Score: -0.7003, 5, 0, 0"
I said send it to the moon please,"Score: 0.3182, 3, 0, 0"
"We can't take money violently out of the hands of government, all we can do is by some sly roundabout way introduce something that they can't stop. – Hayek","Score: -0.4215, 27, -0.030955555555555563, 36"
Let's send this thing to the moon,"Score: 0.0, 4, 0, 0"
"🚨 Changpeng Zhao Transferred to Halfway House, Remains in Custody Amid Legal Troubles 🚨","Score: -0.296, 5, 0, 0"
Paper Wallets -is there a better way now?,"Score: 0.4404, 10, 0.17264347826086954, 46"
New Design for the Flipstarter Directory With a Tiny Campaign to Support Devs,"Score: 0.4019, 20, 0.6807785714285715, 28"
"Bitcoin Cash is the first crypto community to start creating content in the Hausa language, and many other communities are now following its lead.","Score: 0.296, 27, 0.8402, 6"
Govt Employees in El Salvador to Receive Bitcoin Training,"Score: 0.0, 2, 0.16627999999999998, 5"
"Thanks Bitcoin Cash community for your support, Satoshi Nakamoto is among us!","Score: 0.6808, 21, 0.8031666666666667, 6"
How the Fed's Rate Cut Could Skyrocket Bitcoin?,"Score: -0.2732, 1, 0, 0"
"Syscoin and Rollux executives face criminal and civil action in the UAE, Canada, Netherlands","Score: -0.5267, 3, 0, 0"
Testnet transaction not broadcasting,"Score: 0.0, 11, 0.24273461538461538, 26"
Binance Faces Class-Action Lawsuit Over Alleged Crypto Money Laundering,"Score: -0.2263, 16, -0.5106, 1"
The INSANE Truth About Bitcoin,"Score: -0.1027, 9, 0.172915625, 32"
So who is the shot caller for BCH now,"Score: 0.0, 10, 0.47413218390804596, 87"
how much fees to withdraw from blockonomics?,"Score: 0.0, 2, 0.37866249999999996, 8"
Sorry but this one's a dealbreaker.,"Score: -0.0387, 1, -0.35165128205128204, 39"
🚀 Will we see a Bitcoin Macro Top in 2025?,"Score: 0.2023, 0, 0, 0"
Germany Shuts Down Unlicensed Crypto ATMs Nationwide,"Score: 0.0, 17, 0.4215, 12"
Can Bitcoin Stop War? The Potential of Decentralized Finance in Ending Global Conflicts,"Score: -0.8126, 6, -0.5383428571428571, 7"
Why Bitcoin is Back Below $60k?,"Score: 0.0, 4, 0.049425, 20"
When BCH ETF?,"Score: 0.0, 10, 0.4752642857142857, 42"
Rising Interest in Turkey's Crypto Market: Coinbase and KuCoin Join the Race for Licenses 🇹🇷,"Score: 0.6369, 9, 0, 0"
Bitcoin or Fiat,"Score: 0.0, 0, 0, 0"
What Made Billionaire Paul Tudor Jones Bet on Bitcoin?,"Score: 0.0, 0, 0, 0"
Bitcoin Cash BCH 2025 Network Upgrade CHIPs,"Score: 0.0, 53, 0.35762417582417577, 182"
"Metaplanet Inc bought an additional 57.273 bitcoins, valued at 500 million Japanese yen ($3.39 million).","Score: 0.4404, 1, 0, 0"
Flipstarter Bitcoin Cash Mesh Network #6: 1.44 BCH needed with one day remaining. Help us to run the first Bitcoin Cash Meetup in Cuba,"Score: 0.4019, 15, 0.9764, 4"
"""CryptoView"", A free CryptoCurrency Analysis Application","Score: 0.5106, 0, 0, 0"
"The ""Road to Cashtokens"" video fundraiser is 16% complete on fundme.cash. Pledge with Paytaca, Cashonize, or Zapit using Wallet Connect V2. Thanks for your support!","Score: 0.6808, 15, 0, 0"
🐋 Bitcoin Whale Potentially Loses $238 Million in Hacking Incident 🚨,"Score: -0.3182, 7, 0.0, 5"
"This video, created two years ago, marked the beginning of my Bitcoin Cash content creation journey in Hausa language.","Score: 0.4767, 17, 0.8979, 3"
Aaron R Day speaker at the BCH Conference in Argentina,"Score: 0.0, 24, -0.24445999999999998, 5"
USD hyperinflation & Bitcoin,"Score: 0.0, 7, 0.09794800000000001, 25"
"When fear takes over, only the strong keep hodling.","Score: 0.0258, 2, -0.443, 4"
Morgan Stanley is first major Wall Street firm to let advisors recommend Bitcoin ETFs,"Score: 0.3612, 4, -0.1531, 5"
Why is Friedcat AKA Jiang Xinyu known as a Bitcoin pioneer?,"Score: 0.0, 1, 0, 0"
"collaboration cardano and bch coins, any updates??","Score: 0.0, 8, -0.01366666666666668, 3"
Lessons in Decentralization (GP Shorts),"Score: 0.0, 12, 0, 0"
"""New Release: Cashonize desktop v0.1.2 (for Windows)","Score: 0.0, 17, 0, 0"
How to use BCH to access AI images and text,"Score: 0.0, 21, 0.6469153846153847, 26"
CashStamps is live! (stamps.cash),"Score: 0.0, 26, 0.0, 3"
Bitcoin DCA for August 2024! 💎🚀 #KeepStacking #GenerationalWealth,"Score: 0.0, 2, 0, 0"
Books?,"Score: 0.0, 12, 0.2987445086705202, 173"
Create Giftable BCH Vouchers (stamps.cash),"Score: 0.2732, 32, 0.44502749999999996, 40"
Which is your moonshot for the Bull run?,"Score: 0.0, 7, 0.013250000000000003, 6"
Roman Sterlingov Appeals 30-Year Sentence for Bitcoin Fog Money Laundering,"Score: 0.0772, 4, 0, 0"
Flipstarter Bitcoin Cash Mesh Network #6: First Bitcoin Cash meetups in Cuba,"Score: 0.0, 14, 0.6325999999999999, 8"
Digital Payments Platform Flexa Launches Crypto Point-of-Sale Tool,"Score: 0.0, 23, 0.55575, 18"
indeed,"Score: 0.0, 18, -0.1531, 4"
"Bitcoin rises 5.17% to $59,609","Score: 0.0, 10, 0.025733333333333337, 9"
Dubai Court Recognizes Cryptocurrency as Legal Payment for Salaries💰,"Score: 0.128, 22, 0.0, 6"
Kim Dotcom to be extradited from New Zealand after 12-year fight with US,"Score: -0.3818, 28, 0.27122962962962965, 27"
Thank you to the five people who have contributed to the Bitcoin Cash Hausa Flipstarter so far.,"Score: 0.3612, 8, 0.6982222222222222, 9"
Censorship rampant everywhere!,"Score: 0.0, 37, 0.06312931034482759, 116"
My Issue With EarnBitcoin.net — Withdraw Simply Will Not Work Help,"Score: -0.3089, 4, 0.211, 4"
"""Walking Banks"", a free bitcoin novel","Score: 0.6808, 7, 0.3182, 1"
"Bitcoin & Ethereum Technical Analysis for August 16 , 2024 - BTC - ETH","Score: 0.0, 2, 0, 0"
"""Can I use it when I need to?"" is more important to what people consider money than ""does it lose value sometimes?""","Score: 0.2006, 29, 0.4334882352941176, 68"
AnyHedge In The Paytaca Wallet (GP Shorts),"Score: 0.0, 15, 0, 0"
Why Bitcoin is Down Today?,"Score: 0.0, 5, 0.008649999999999991, 4"
"Help fund ""The Road to CashTokens"", a Bitcoin Out Loud Video [fundme.cash]","Score: 0.4019, 11, 0, 0"
Massive Banks Are Now Accused of Cheating Customers Billions,"Score: -0.7003, 25, 0.2748904761904762, 21"
Blockchain holding my funds for over 2 years,"Score: 0.0, 11, 0.13190000000000002, 25"
If you had to put a chance % on btc reaching 1 million per coin?,"Score: 0.4215, 9, 0.10462635983263599, 239"
"US government transfers 10,000 BTC to Coinbase","Score: 0.0, 13, -0.11105, 8"
I found a old paper wallet with some btc,"Score: 0.0, 2, 0.043833333333333335, 33"
People aren't aware enough of why crypto was invented.,"Score: 0.0, 62, 0.3116384615384615, 26"
BCH The Big Block King -> Handling more transactions than everything waiting on BTC.,"Score: -0.4404, 21, -0.01822285714285715, 140"
"[Not your keys, not your BTC]Celsius is suing thousands of retail users for BTC they withdrew before their bankruptcy. If you withdrew 10 BTC(250K) before the collapse in 2022, they're now suing you for today's price(600k+). The victims who lost their BTC are being paid back with 2022 prices.","Score: -0.8689, 61, -0.059517567567567556, 74"
The Bitcoin Cash Podcast #123: BTC Conference & BCH Vibes feat. Kallisti & Steve Thurmond,"Score: 0.0, 17, 0, 0"
I asked chat GPT how likely X company is to buy Bitcoin in the next 3 years.,"Score: 0.0, 3, 0.22086666666666666, 15"
The hell is going on?,"Score: -0.6808, 13, 0.08153870967741934, 31"
Bitcoin ETFs on track to holding more BTC than Satoshi soon,"Score: 0.0, 15, 0.11237222222222222, 18"
Jack Mallers Man Behind El Salvador Bitcoin Revolution!,"Score: 0.0, 9, 0.029775, 16"
Best exchange website for BTC - USDT,"Score: 0.6369, 0, 0, 0"
Kamala Harris Might Continue Strict Crypto Regulations,"Score: 0.0, 6, 0.06721428571428571, 21"
Coinbase's cbBTC Teaser Fuels Rumors of Wrapped BTC Token,"Score: -0.25, 1, 0, 0"
Ted Cruz Calls Bitcoin an 'Energy Safety Net' for Texas,"Score: 0.4215, 12, 0.4599947368421053, 19"
MTgox creditors report receiving BCH and BTC on Bitgo the fifth and final exchange set to distribute funds.,"Score: -0.0258, 18, 0, 0"
"No other cryptocurrency has a ground game like Bitcoin Cash, BCH. Except stablecoins linked to the US dollar. But we all know the inevitable fate of all fiat currencies...","Score: 0.2144, 25, 0.24032820512820513, 39"
Marathon Digital to raise $250M for Bitcoin operations,"Score: 0.0, 3, -0.03972500000000001, 16"
"“We're going to see a number of more single asset products, and then also certainly some index based and diversified products,” Dave Lavalle, Grayscale’s global head of ETFs, said Aug. 12. Hopefully we get a BCH one soon.","Score: 0.8008, 4, 0.3896323529411765, 34"
Bitcoin Price Dips Below $60K: What's Next?,"Score: 0.0, 2, -0.14159999999999998, 4"
The Catch-22 of Decentralization (GP Shorts),"Score: 0.0, 13, 0, 0"
Indexer Performance Compared: BCHD vs BCHC,"Score: 0.0, 27, 0.630275, 64"
The amount of Bitcoin held on exchanges has hit a five-year low,"Score: 0.0772, 11, 0.1853923076923077, 13"
JPMorgan Predicts a Recession is on the way - Is this bad news for Bitcoin??,"Score: -0.7861, 2, -0.1779, 2"
A Call to Supporters of Bitcoin Cash Adoption,"Score: 0.2732, 18, 0, 0"
Bitcoin Maxis: Would You Use an Atomic Lending Protocol on BTC?,"Score: 0.0, 1, -0.5719, 1"
BTC Mining l,"Score: 0.0, 5, 0.22213636363636366, 11"
🚨 Israeli Tourists Robbed of $700K in Costa Rica Bitcoin Heist,"Score: 0.0, 13, 0.045927272727272726, 33"
badgers.cash NFT's now available for minting,"Score: 0.0, 11, 0.1154, 3"
"As suspected it appears that Tether prints dollars from thin air and uses Bitcoin as collaterol. This is literally what USTerra/luna scheme did, backing their ""dollars"" with Bitcoin. Celsius is suing Tether over this due to a disagreement.","Score: -0.6597, 24, 0.02621538461538462, 13"
"To encourage more business owners to accept Bitcoin Cash, I published an article in Hausa titled, ""As You Accept Naira, You Can Also Accept Bitcoin Cash and You Won't Regret It."" In the article, I explain how accepting Bitcoin Cash can help their businesses grow.","Score: 0.9118, 21, 0.4019, 4"
How to buy BTC or XMR with prepaid debit card in the US?,"Score: 0.0, 7, 0.25681666666666664, 12"
🌴 Santa Monica Unveils New Bitcoin Office to Boost Industry Partnerships and Create Jobs🚀,"Score: 0.5859, 6, -0.7506, 1"
This is how they fooled the world into thinking BTC is still good.,"Score: 0.0772, 3, -0.12126666666666669, 9"
Is there an easy to way to buy BCH with fiat in a non-KYC way?,"Score: 0.4404, 31, 0.1298397590361446, 83"
CFTC Awards Significant Whistleblower Payout in Crypto Enforcement Case,"Score: 0.6486, 0, 0, 0"
Nic Carter wrote a great exposition about the US energy sector's changing relationship with SHA256 and ETH mining in 2021. It's a great read for people that aren't caught up on the real world inputs to modern cryptocurrencies.,"Score: 0.8834, 6, 0, 0"
"Reveal did a great episode in 2022 about the US domestic energy side of bitcoin called: ""Can Our Climate Survive Bitcoin?""; anyone who wants to know what is powering modern bitcoin should listen.","Score: 0.7579, 11, 0.43116875, 16"
BitcoinCash Football League  Nigeria  ⚽️🇳🇬💚,"Score: 0.0, 25, 0.3397, 28"
CryptoQuest: The Ultimate Bitcoin & Blockchain Quiz Game | Blockchain Innovation | Episode 6,"Score: 0.3818, 3, 0, 0"
🚨 OKX to Ban Accounts Linked to Tornado Cash,"Score: -0.5574, 13, 0.07283333333333335, 12"
Putin Signs Law Legalizing Crypto Mining in Russia,"Score: 0.0, 0, 0, 0"
$2.5B of Bitcoin and Ether options to expire,"Score: 0.0, 9, 0, 0"
What if btc does actually become sov,"Score: 0.0, 1, -0.13664199999999999, 50"
What’s Got You Hyped in Bitcoin Right Now? What's the latest trend around Bitcoin?,"Score: 0.0, 5, 0.19450144927536234, 69"
Donald Trump Jr. to Challenge Banks with Crypto Platform,"Score: 0.0772, 2, 0, 0"
The Harder Retail Problem (GP Shorts),"Score: -0.4019, 11, 0, 0"
Bitcoin Cash is solidly the 4th most used coin on Bitpay for last 2 months.,"Score: 0.0, 62, 0.15754098360655736, 61"
Putin Signs Law Legalizing Cryptocurrency Mining in Russia,"Score: 0.0, 4, -0.006074999999999997, 4"
BCHBull is paying 3.6% for 7 day loans/hedges. This is over 188% APR not including that is is cumulative interest as well.,"Score: 0.6249, 30, 0, 0"
"I onboarded a new merchant! It took some time, as I had to continually convince the shop owner where I buy daily items. I kept engaging with him and explaining more about Bitcoin Cash. Now, he has agreed to start accepting Bitcoin Cash.","Score: 0.8591, 30, 0.296, 5"
"British Court Freezes Assets of OneCoin ""Cryptoqueen"" Ruja Ignatova🧊","Score: 0.4019, 8, -0.046171428571428565, 7"
Craig Wright misses deadline for UK court case appeal,"Score: -0.1531, 32, -0.079688, 50"
"Latest NanoGPT updates: API keys, Llama 3.1 405b and 70b, other new models","Score: 0.0, 15, 0.42874999999999996, 2"
Bitcoin’s hashprice hit a record low. That’s a big problem for miners,"Score: -0.5859, 2, 0.12236000000000001, 15"
Bitcoin was meant to be Cash!,"Score: 0.0, 37, 0.8625, 4"
Bitcoin Holders Make Money Even When Prices Drop,"Score: -0.2732, 0, 0, 0"
Metaplanet Announces $58 Million Bitcoin Investment,"Score: 0.0, 1, 0, 0"
Crypto Market Bouncing back?,"Score: 0.0, 0, 0, 0"
Want to end the fed? Stop using the dollar.,"Score: -0.2263, 30, 0.0, 1"
"Bitcoin Bear Trap, Japan's NKY Crash, Crypto Fundamentals | Chart Champ Podcast | Ep #3: Mike Fay","Score: -0.2263, 0, 0, 0"
WiFi hotspots and subscribed to using p2p cash - anyone know of such an app?,"Score: 0.0, 10, 0, 0"
Today an early supporter of the Mesh Network has started to test BCH,"Score: 0.5423, 53, 0.47375, 40"
"In order for Bitcoin Cash (BCH) to survive, it needs to innovate or face irrelevancy","Score: 0.4939, 28, 0.5090387096774193, 124"
Let’s differentiate BCH sats from BTC sats,"Score: 0.0, 11, 0.13536833333333334, 60"
The market crash has made Bitcoin mining unprofitable. Which devices are still profitable?,"Score: 0.3818, 4, 0.40043999999999996, 10"
Flipstarter Proposal: Bringing Bitcoin Cash (BCH) to the Interchain,"Score: 0.0, 8, 0.2669916666666667, 24"
Bitcoin Reserve Bill,"Score: 0.0, 9, 0.2709022727272727, 44"
Extreme Fear Grips Crypto as BTC ETF Outflows Hit $168M,"Score: -0.4939, 1, -0.27115, 2"
Mempool Size Limits (GP Shorts),"Score: 0.0, 15, 0, 0"
"Bitcoin Price Soars to $55,500! Is the Crash Finally Over?","Score: -0.4019, 8, -0.0772, 8"
